{
  "$schema": "https://json-schema.org/draft/2020-12/schema",
  "type": "object",
  "required": [
    "dataset",
    "as_of",
    "analytics_as_of",
    "version",
    "overview",
    "treasury",
    "leaderboards",
    "recent"
  ],
  "properties": {
    "dataset": {
      "const": "dao_metrics"
    },
    "analytics_as_of": {
      "type": "string"
    },
    "as_of": {
      "type": "string"
    },
    "version": {
      "type": "integer"
    },
    "overview": {
      "type": "object"
    },
    "treasury": {
      "type": "object"
    },
    "leaderboards": {
      "type": "object"
    },
    "recent": {
      "type": "object"
    }
  },
  "additionalProperties": false
}
