{
  "dataset": "dao_metrics",
  "as_of": "2026-03-20T20:14:44.603849Z",
  "version": 1,
  "overview": {
    "proposal_count": 222,
    "active_proposal_count": 2,
    "successful_proposal_count": 170,
    "closed_outcome_count": 219,
    "proposal_success_rate_pct": 77.63,
    "people_count": 1180,
    "holders_count": 1011,
    "delegates_count": 992,
    "contributors_count": 98,
    "athletes_count": 41,
    "recipients_count": 51,
    "proposers_count": 73,
    "unique_voters_count": 464,
    "avg_votes_per_proposal": 20.03,
    "median_votes_per_proposal": 21.0,
    "workstream_count": 2,
    "workstream_status_counts": {
      "governance-active": 1,
      "superseded": 1
    },
    "treasury_assets_count": 6,
    "treasury_total_value_usd": 44736.99098223059,
    "outflows_eth": 21.27165954,
    "outflows_usdc": 170693.0,
    "outflows_gnars": 0,
    "fungible_transfer_count": 65,
    "nft_transfer_count": 20,
    "routed_proposal_count": 55,
    "routed_proposal_share_pct": 24.77,
    "top10_recipient_concentration_usdc_pct": 65.8,
    "top10_recipient_concentration_eth_pct": 94.94,
    "proposals_30d": 7,
    "successful_proposals_30d": 1,
    "payout_routes_30d": 1,
    "deliveries_30d": 3,
    "active_recipients_30d": 1,
    "days_since_last_proposal": 0,
    "days_since_last_payout": 3,
    "days_since_last_delivery": 2,
    "proposal_status_counts": {
      "active": 2,
      "cancelled": 16,
      "closed": 101,
      "defeated": 22,
      "executed": 80,
      "succeeded": 1
    }
  },
  "treasury": {
    "wallet_address": "0x72ad986ebac0246d2b3c565ab2a1ce3a14ce6f88",
    "wallet_label": "Gnars DAO Treasury",
    "homepage_treasury_label_usd": 46500.0,
    "treasury_page_total_value_usd": 44736.99098223059,
    "treasury_page_display_total_usd": 0.0,
    "assets": [
      {
        "symbol": "USDC",
        "name": "USD Coin",
        "amount": 21396.243942,
        "value_usd": 21394.703412436178
      },
      {
        "symbol": "SENDIT",
        "name": "Sendit",
        "amount": 474092937.5544444,
        "value_usd": 4574.996847400389
      },
      {
        "symbol": "WETH",
        "name": "Wrapped Ether",
        "amount": 0.02752447,
        "value_usd": 58.41710939389999
      },
      {
        "symbol": "GNARS",
        "name": "gnars",
        "amount": 562300.0,
        "value_usd": 8.74
      },
      {
        "symbol": "SKATEHACKER",
        "name": "skatehacker",
        "amount": 69400.0,
        "value_usd": 1.89
      },
      {
        "symbol": "ZIMARDRP",
        "name": "zimardrp",
        "amount": 111100.0,
        "value_usd": 1.37
      }
    ]
  },
  "leaderboards": {
    "eth_received": [
      {
        "display_name": "gami.eth",
        "address": "0x387a161c6b25aa854100abaed39274e51aaffffd",
        "slug": "gami-eth",
        "value": 10.35730283,
        "label": "ETH received"
      },
      {
        "display_name": "0xe8b2...599d",
        "address": "0xe8b290f49c2fb50ab018d89626e77c2321dc599d",
        "slug": "0xe8b2-599d",
        "value": 3.0,
        "label": "ETH received"
      },
      {
        "display_name": "0x2443...5c87",
        "address": "0x244306053c673b93bc9885fdacfc352032725c87",
        "slug": "0x2443-5c87",
        "value": 1.0,
        "label": "ETH received"
      },
      {
        "display_name": "0xe5f6...8beb",
        "address": "0xe5f6202ff7ddc5273c249073865bc6f4d5d68beb",
        "slug": "0xe5f6-8beb",
        "value": 1.0,
        "label": "ETH received"
      },
      {
        "display_name": "r4topunk",
        "address": "0x39a7b6fa1597bb6657fe84e64e3b836c37d6f75d",
        "slug": "r4topunk",
        "value": 1.0,
        "label": "ETH received"
      },
      {
        "display_name": "rocketman21.eth",
        "address": "0x289715ffbb2f4b482e2917d2f183feab564ec84f",
        "slug": "rocketman21-eth",
        "value": 1.0,
        "label": "ETH received"
      },
      {
        "display_name": "fuzzyface.eth",
        "address": "0x33bbf6e27ce7b254e537bcb9f3b00cd1451563ea",
        "slug": "fuzzyface-eth",
        "value": 0.99,
        "label": "ETH received"
      },
      {
        "display_name": "0x5979...8db0",
        "address": "0x597960438e28e3b529dcea95c267dc9cfc458db0",
        "slug": "0x5979-8db0",
        "value": 0.8,
        "label": "ETH received"
      },
      {
        "display_name": "fernandoferreira.eth",
        "address": "0x49d31dcb59e115f5c9e505a58a323ade076f2176",
        "slug": "fernandoferreira-eth",
        "value": 0.619,
        "label": "ETH received"
      },
      {
        "display_name": "fattybuthappy.eth",
        "address": "0xedc1a397589a0236c4810883b7d559288a5fe7e1",
        "slug": "fattybuthappy-eth",
        "value": 0.43,
        "label": "ETH received"
      }
    ],
    "usdc_received": [
      {
        "display_name": "0xe5f6...8beb",
        "address": "0xe5f6202ff7ddc5273c249073865bc6f4d5d68beb",
        "slug": "0xe5f6-8beb",
        "value": 29215.0,
        "label": "USDC received"
      },
      {
        "display_name": "0xe1b9...9641",
        "address": "0xe1b91eb3f3747d00485e95da79041e6d9d399641",
        "slug": "0xe1b9-9641",
        "value": 16116.0,
        "label": "USDC received"
      },
      {
        "display_name": "0x3f51...f7f2",
        "address": "0x3f5111e64c0b96cc6b436151da820a3f979ef7f2",
        "slug": "0x3f51-f7f2",
        "value": 12000.0,
        "label": "USDC received"
      },
      {
        "display_name": "0x7351...53f8",
        "address": "0x735135ff4152b3ae255ca708eb37d83b0a8853f8",
        "slug": "0x7351-53f8",
        "value": 9900.0,
        "label": "USDC received"
      },
      {
        "display_name": "0xc407...3c28",
        "address": "0xc4079dc1f8f84711eee0942c192829f473fc3c28",
        "slug": "0xc407-3c28",
        "value": 8000.0,
        "label": "USDC received"
      },
      {
        "display_name": "luizhadad.eth",
        "address": "0xfc27b375faf1fbd3f3462044cf810082f042a45b",
        "slug": "luizhadad-eth",
        "value": 7888.0,
        "label": "USDC received"
      },
      {
        "display_name": "0x0a7b...442e",
        "address": "0x0a7b7374d9cba3ac9d31f18b2cd45aac4b3b442e",
        "slug": "0x0a7b-442e",
        "value": 7870.0,
        "label": "USDC received"
      },
      {
        "display_name": "0x459b...69de",
        "address": "0x459b40643251f10d93334d91cf256f97d31f69de",
        "slug": "0x459b-69de",
        "value": 7500.0,
        "label": "USDC received"
      },
      {
        "display_name": "0x9d4e...937f",
        "address": "0x9d4e88f7f2ccbb005426c1ed91eb2bb7d235937f",
        "slug": "0x9d4e-937f",
        "value": 6969.0,
        "label": "USDC received"
      },
      {
        "display_name": "overhau1.eth",
        "address": "0xed7be8b630924f437c28af58a99cc63fc80413f4",
        "slug": "overhau1-eth",
        "value": 6850.0,
        "label": "USDC received"
      }
    ],
    "gnars_received": [],
    "proposal_count": [
      {
        "display_name": "davinoyesigye.eth",
        "address": "0xdfb6ed808fadddad9154f5605e349fff96e3d939",
        "slug": "davinoyesigye-eth",
        "value": 36,
        "label": "proposals authored"
      },
      {
        "display_name": "0x41cb...be4a",
        "address": "0x41cb654d1f47913acab158a8199191d160dabe4a",
        "slug": "0x41cb-be4a",
        "value": 22,
        "label": "proposals authored"
      },
      {
        "display_name": "gnars.com",
        "address": "0x73222225044ce0fc672ff9b6f9730d0a0421382c",
        "slug": "gnars-com",
        "value": 17,
        "label": "proposals authored"
      },
      {
        "display_name": "gami.eth",
        "address": "0x387a161c6b25aa854100abaed39274e51aaffffd",
        "slug": "gami-eth",
        "value": 10,
        "label": "proposals authored"
      },
      {
        "display_name": "zimardrp.eth",
        "address": "0x2feb329b9289b60064904fa61fc347157a5aed6a",
        "slug": "zimardrp-eth",
        "value": 7,
        "label": "proposals authored"
      },
      {
        "display_name": "0xddd7...645f",
        "address": "0xddd7c01cecdbd0ac633ef7405a60165f731e645f",
        "slug": "0xddd7-645f",
        "value": 6,
        "label": "proposals authored"
      },
      {
        "display_name": "fuzzyface.eth",
        "address": "0x33bbf6e27ce7b254e537bcb9f3b00cd1451563ea",
        "slug": "fuzzyface-eth",
        "value": 6,
        "label": "proposals authored"
      },
      {
        "display_name": "0xd119...c7d8",
        "address": "0xd1195629d9ba1168591b8ecdec9abb1721fcc7d8",
        "slug": "0xd119-c7d8",
        "value": 5,
        "label": "proposals authored"
      },
      {
        "display_name": "gondy.eth",
        "address": "0x56b6dcddd5d96535c35b720c96e19939920544d8",
        "slug": "gondy-eth",
        "value": 5,
        "label": "proposals authored"
      },
      {
        "display_name": "0xeed9...a282",
        "address": "0xeed943aa972dd394146e6f77b9434df07f36a282",
        "slug": "0xeed9-a282",
        "value": 4,
        "label": "proposals authored"
      }
    ],
    "attendance_pct": [
      {
        "display_name": "zimardrp.eth",
        "address": "0x2feb329b9289b60064904fa61fc347157a5aed6a",
        "slug": "zimardrp-eth",
        "value": 71,
        "label": "attendance %"
      },
      {
        "display_name": "r4topunk",
        "address": "0x39a7b6fa1597bb6657fe84e64e3b836c37d6f75d",
        "slug": "r4topunk",
        "value": 68,
        "label": "attendance %"
      },
      {
        "display_name": "rickyday.eth",
        "address": "0xb2b7d66bb56ce8ff7838dc8053ff35050ed95e9d",
        "slug": "rickyday-eth",
        "value": 64,
        "label": "attendance %"
      },
      {
        "display_name": "willdias.eth",
        "address": "0xddb4938755c243a4f60a2f2f8f95df4f894c58cc",
        "slug": "willdias-eth",
        "value": 64,
        "label": "attendance %"
      },
      {